place,address
トイザらス市川,千葉県市川市鬼高１－１－１ニッケコルトンプラザイースト館２Ｆ
トイザらス市原,千葉県市原市八幡１０４９－１
トイザらス柏,千葉県柏市松ケ崎１１８１－１
トイザらス成田,千葉県成田市飯仲９－４
トイザらス千葉長沼,千葉県千葉市稲毛区長沼町３３０－５０
トイザらス松戸,千葉県松戸市二ツ木１７８１－２プチモール二ツ木２Ｆ
トイザらス野田,千葉県野田市中根新田字鹿島原５７－１パル・ノア２Ｆ
トイザらス新鎌ヶ谷,千葉県鎌ケ谷市新鎌ケ谷２－１２－１アクロスモール新鎌ヶ谷２Ｆ
ヤマダ電機ＬＡＢＩ津田沼,千葉県習志野市谷津１－１６－１モリシア津田沼３Ｆ
西友常盤平,千葉県松戸市常盤平３－１１－１
ＪＯＹＦＵＬ－２千葉ニュータウン店　,千葉県印西市草深１９２１
ダイエー新松戸,千葉県松戸市新松戸３－２－２
ダイエー新浦安,千葉県浦安市入船１－４－１
ダイエー南行徳,千葉県市川市南行徳２－２０－２５
サンファンタジー千城台,千葉県千葉市若葉区千城台北３－２１－１ラパーク千城台３Ｆ
セガワールド旭,千葉県旭市二３１５０－１
セガ幕張,千葉県千葉市美浜区ひび野１－８メッセ・アミューズ・モール１階
ＳＥＧＡＡＲＥＮＡＳＯＧＡ,千葉県千葉市中央区川崎町５１－１ハーバーシティ蘇我フェスティバルウォークアミューズメント棟１Ｆ
セガ我孫子,千葉県我孫子市柴崎字天王台４７－１
ヨドバシカメラ千葉,千葉県千葉市中央区富士見２－３－１
にこぱアクロスモール新鎌ヶ谷店,千葉県鎌ヶ谷市初富９２８番地アクロスモール新鎌ヶ谷２Ｆ
ニコパマリンピア店,千葉県千葉市美浜区高洲３－１３－１マリンピア４階
ハローズガーデン市原店,千葉県市原市青柳北１－１アピタ市原店２階
こころっこ君津店,千葉県君津市中野５－１７－１ダイエー君津店内３Ｆプレビプレイランドコーナーこころっこ
こころっこ新浦安店,千葉県浦安市明海４－１－１イトーヨーカドー新浦安店内３階プレビプレイランドコーナーこころっこ
こころっこＪ’Ｓ横芝店,千葉県山武郡横芝光町横芝２１２２サビア横芝店内プレビプレイランドコーナーこころっこＪ’ｓ
マリンガーデンららぽーと船橋,千葉県船橋市浜町２丁目１番１号ららぽーとＴＯＫＹＯ－ＢＡＹ西館３階
テクモピア公津の杜店,千葉県成田市公津の杜４－５－３成田ユアエルム３Ｆ
ＴＨＥ　３ＲＤ　ＰＬＡＮＥＴフレスポ稲毛店,千葉県千葉市稲毛区長沼原町７３１－１７
そごう千葉,千葉県千葉市中央区新町１０００そごう千葉店本館６Ｆ
アピタ木更津　,千葉県木更津市ほたるの４－２－４８
アピタ市原　　,千葉県市原市青柳北１－１
アピタ君津　　,千葉県君津市久保１－１－１
野田ホビー　ノア店,千葉県野田市中根３６ショッピングセンターノア３Ｆ
プラサカプコン富津,千葉県富津市青木一丁目５番地１イオンモール富津２Ｆ
プラサカプコン成田,千葉県成田市ウイング土屋２４イオンモール成田２Ｆ
プラサカプコン千葉ニュータウン,千葉県印西市中央北３－３イオンモール千葉ニュータウンシネマスポーツ棟２Ｆ
プラサカプコンちはら台,千葉県市原市ちはら台西３－４ショッピングモールｕｎｉｍｏちはら台２Ｆ
ビバ・サーカス茂原店,千葉県茂原市高師１７３５茂原ショッピングプラザアスモ２Ｆ
タイトーステーション　新柏ＰＡＺ店,千葉県柏市名戸ケ谷字中久保８８８番１号ＰＡＺ新柏２Ｆ
タイトーステーション　茂原アスモ店,千葉県茂原市高師１７３５茂原ショッピングプラザアスモ２Ｆ
タイトーステーション　旭サンモール店,千葉県旭市イ－２６７６－１サンモール３Ｆ
タイトーＦステーション　イオン市川妙典店,千葉県市川市妙典４丁目１番１号イオン市川妙典店２番街２階
キャッツアイ八千代店,千葉県八千代市吉橋１８５１番地ｉｓｍ緑が丘内
イトーヨーカドー津田沼,千葉県習志野市津田沼１－１０－３０
イトーヨーカドー姉崎,千葉県市原市姉崎６４５－１
イトーヨーカドー松戸,千葉県松戸市松戸１１４９
イトーヨーカドー船橋,千葉県船橋市本町７－６－１
イトーヨーカドー八柱,千葉県松戸市日暮１－１５－８
イトーヨーカドー我孫子南口,千葉県我孫子市本町３－２－２８
イトーヨーカドー流山,千葉県流山市流山９－８００－２
イトーヨーカドー我孫子,千葉県我孫子市我孫子４－１１－１
イトーヨーカドー東習志野,千葉県習志野市東習志野７－３－１
イトーヨーカドー幕張,千葉県千葉市花見川区幕張町４－４１７－２５
イトーヨーカドー成田,千葉県成田市公津の杜４－５－３
イトーヨーカドー新浦安,千葉県浦安市明海４－１－１
イトーヨーカドー八千代,千葉県八千代市村上４００１－４
イトーヨーカドー四街道,千葉県四街道市四街道都市核北土地区画整理事業地内５街区
イトーヨーカドーアリオ蘇我,千葉県千葉市中央区川崎町５２－７
ソユープレイランドソピア幕張店,千葉県千葉市花見川区幕張町四丁目４１７－２５イトーヨーカドー幕張店２Ｆ
ＥＧＧＳ　ＰＯＲＴ船橋店,千葉県船橋市浜町二丁目１番１号ららぽーとＴＯＫＹＯ－ＢＡＹ北館１階
ゲオ富里店　　　　　,千葉県富里市七栄５７５番地
イトーヨーカドーアリオ市原,千葉県市原市更級４-３-２
モーリーファンタジーイオン成田,千葉県成田市ウイング土屋２４番地イオン２Ｆ
モーリーファンタジーおゆみ野,千葉県千葉市緑区おゆみ野南５丁目３７－１イオンタウン２Ｆ
モーリーファンタジーノア,千葉県野田市中根３６－１イオン１Ｆ
モーリーファンタジー鎌ヶ谷,千葉県鎌ヶ谷市新鎌ヶ谷２丁目７番１号イオン２Ｆ
モーリーファンタジー鎌取,千葉県千葉市緑区おゆみ野３丁目１６番地イオン４Ｆ
モーリーファンタジー館山,千葉県館山市八幡５４５－１イオン１Ｆ
モーリーファンタジー市川妙典３Ｆ,千葉県市川市妙典５－３－１イオン３Ｆ
モーリーファンタジー千葉ニュ－タウン,千葉県印西市中央北３丁目１番１イオン３Ｆ
モーリーファンタジー船橋,千葉県船橋市山手１丁目１番地８号イオン３Ｆ
モーリーファンタジー銚子,千葉県銚子市三崎町２丁目２６６０－１イオン２Ｆ
モーリーファンタジー津田沼,千葉県習志野市津田沼１丁目２３番１号イオン３Ｆ
モーリーファンタジー東習志野,千葉県習志野市東習志野６丁目７－８イオンタウン１Ｆ
モーリーファンタジー柏,千葉県柏市豊町２丁目５番２５号イオン２Ｆ
モーリーファンタジー八街,千葉県八街市文違３０１イオン１Ｆ
モーリーファンタジー八千代緑が丘,千葉県八千代市緑が丘２丁目１－３イオン４Ｆ
モーリーファンタジー幕張新都心,千葉県千葉市美浜区豊砂１－５イオンモール（ファミリーモール）２Ｆ
パロ市川,千葉県市川市鬼高１－１－１ニッケコルトンプラザ２Ｆ
ファンキッズ市川,千葉県市川市鬼高１－１－１ダイエーいちかわコルトンプラザ４Ｆ
らんらんらんどあすみが丘,千葉県千葉市緑区あすみが丘７丁目１あすみが丘ブランニューモール２Ｆ
らんらんらんど酒々井,千葉県印旛郡酒々井町本佐倉４５７－２トライアル酒々井店２Ｆ
らんらんらんど千葉長沼,千葉県千葉市稲毛区長沼町３３０－５０ダイエー千葉長沼店１Ｆ
らんらんらんど南行徳,千葉県市川市南行徳２－２０－２５ダイエー南行徳店２Ｆ
ビックカメラ柏店,千葉県柏市柏市１－１－２０スカイプラザ柏
イオン臼井,千葉県佐倉市王子台１－２３
イオンユーカリが丘,千葉県佐倉市ユ－カリが丘４－１－１
イオンマリンピア,千葉県千葉市美浜区高洲３－１３－１
イオン幕張,千葉県千葉市美浜区ひび野１－３
イオン稲毛,千葉県千葉市稲毛区小仲台１－４－２０
イオン銚子,千葉県銚子市三崎町２－２６６０－１
イオン柏,千葉県柏市豊町２－５－２５
イオンイオン成田,千葉県成田市ウイング土屋２４
イオン千葉ニュータウン,千葉県印西市中央北３－１－１
イオン館山,千葉県館山市八幡５４５－１
イオン八千代緑ヶ丘,千葉県八千代市緑が丘２－１－３
イオン鎌取,千葉県千葉市緑区おゆみ野３－１６－１
イオン船橋,千葉県船橋市山手１－１－８
イオンキッズ津田沼,千葉県習志野市津田沼１－２３－１
