place,address
イオン大野城,福岡県大野城市錦町４−１−１
イオン福岡,福岡県糟屋郡粕屋町酒殿字老ノ木１９２−１
トイザらス小倉,福岡県北九州市小倉南区下曽根新町１０−１ザ・モール小倉２Ｆ
ＳＥＧＡＡＲＥＮＡ中間,福岡県中間市上蓮花寺３−１−１
トイザらス福岡ホークスタウン,福岡県福岡市中央区地行浜２−２−１ホークスタウン１Ｆ
アミパラフォレオ博多店,福岡県福岡市博多区東那珂１丁目１４−４６フォレオ博多２Ｆ
ＡＢＣパレード博多店,福岡県福岡市東区東浜１−１−１ゆめタウン２Ｆ
トイザらス大牟田,福岡県大牟田市旭町２２８−１
トイザらス久留米,福岡県久留米市新合川１３−３０
トイザらス福岡香椎,福岡県福岡市東区香椎浜３１２−１
プラサカプコン直方,福岡県直方市湯野原２−１−１イオンモール直方２Ｆ
トイザらス八幡,福岡県北九州市八幡東区東田３−２−１０２イオンモール八幡東１Ｆ
タイトーステーション　マリノア店,福岡県福岡市西区小戸２−１２−３０マリノアシティ福岡マリナサイド棟２Ｆ
タイトーステーション　リバーウォーク店,福岡県北九州市小倉北区室町１ー１−１
タイトーステーション　ヨドバシ博多店,福岡県福岡市博多区博多駅中央街６ー１２
タイトーステーション　博多パピヨンプラザ店,福岡県福岡市博多区千代１−２−１７
タイトーステーション　福岡天神店,福岡県福岡市中央区天神２ー６ー３５サザンクロスビル
タイトーＦステーション　大牟田店,福岡県大牟田市旭町２−２８−１
小倉コロナワールド,福岡県北九州市小倉北区西港町２７−５
