place,address
ミスターマックス時津,長崎県西彼杵郡時津町左底郷１８３２−１
モーリーファンタジー時津,長崎県西彼杵郡時津町浜田郷７５１−５イオン２Ｆ
モーリーファンタジー大村,長崎県大村市幸町２５−２００イオン２Ｆ
モーリーファンタジー大塔,長崎県佐世保市大塔町１４−２イオン３Ｆ
モーリーファンタジー東長崎,長崎県長崎市田中町１０２７−８イオン２Ｆ
モーリーファンタジー有家,長崎県南島原市有家町山川１３５−１イオン１Ｆ
らんらんらんど長崎千歳,長崎県長崎市千歳町５番１号ダイエー千歳店３Ｆ
ミスターマックス長崎,長崎県長崎市岩見町２６−１
西友諌早,長崎県諫早市永昌東町２−１
ダイエー壱岐,長崎県壱岐市芦辺町箱崎中山触字干拓２６０４−２
ダイエーチトセピア,長崎県長崎市千歳町５−１
楽市楽座諫早,長崎県諌早市長野町１０８６番地１７
スペースタイム２５イオン佐世保,長崎県佐世保市島瀬町１０−９イオン佐世保８階
らんらんらんど壱岐,長崎県壱岐市芦辺町箱崎中山触字干拓２６０４−２ダイエー壱岐店２Ｆ
あおき長崎葉山,長崎県長崎市葉山１丁目28-15S＆B葉山ショッピングプラザ１F
イオン佐世保,長崎県佐世保市島瀬町１０−９
イオン時津,長崎県西彼杵郡時津町浜田郷７５１−５
イオン大村,長崎県大村市幸町２５−２００
イオン大塔,長崎県佐世保市大塔町１４−２
イオン東長崎,長崎県長崎市田中町１０２７−８
イオン有家,長崎県南島原市有家町山川１３５−１
セガワールド長崎ココウォーク,長崎県長崎市茂里町１番５５号みらい長崎ココウォーク５階
ぴのきお,長崎県北松浦郡佐々町本田原免７３−３マックスバリュー佐々店２Ｆ
